{
  "$schema": "https://json-schema.org/draft/2020-12/schema",
  "$id": "https://mestre-yoda.dev/schemas/state/evidence/v1",
  "title": "Mestre Yoda evidence metadata v1",
  "type": "object",
  "additionalProperties": false,
  "required": [
    "contractVersion",
    "stateContract",
    "evidenceId",
    "kind",
    "ref",
    "sha256",
    "classification",
    "redaction",
    "recordedAt"
  ],
  "properties": {
    "contractVersion": { "const": "1.0.0" },
    "stateContract": { "const": "1.0.0" },
    "evidenceId": { "$ref": "#/$defs/id" },
    "kind": {
      "enum": ["artifact", "event", "approval", "test", "observation"]
    },
    "ref": { "$ref": "#/$defs/reference" },
    "sha256": { "$ref": "#/$defs/sha256" },
    "classification": { "enum": ["public", "internal", "restricted"] },
    "redaction": { "enum": ["none", "metadata-only", "redacted"] },
    "recordedAt": { "$ref": "#/$defs/timestamp" }
  },
  "$defs": {
    "id": {
      "type": "string",
      "pattern": "^[a-zA-Z0-9][a-zA-Z0-9._:-]{0,127}$"
    },
    "sha256": { "type": "string", "pattern": "^[a-f0-9]{64}$" },
    "timestamp": {
      "type": "string",
      "pattern": "^\\d{4}-\\d{2}-\\d{2}T\\d{2}:\\d{2}:\\d{2}(?:\\.\\d{1,9})?Z$"
    },
    "reference": {
      "type": "string",
      "minLength": 1,
      "maxLength": 1024,
      "pattern": "^(?!/)(?![A-Za-z]:[\\\\/])(?!.*\\\\)(?!.*(?:^|/)\\.\\.(?:/|$))(?![a-z][a-z0-9+.-]*://)[^\\u0000-\\u001f\\u007f]+$"
    }
  }
}
