{
  "contractVersion": "1.0.0",
  "stateContract": "1.0.0",
  "evidenceId": "evidence-01",
  "kind": "test",
  "ref": ".brain/evidence/test-01.json",
  "sha256": "eeeeeeeeeeeeeeeeeeeeeeeeeeeeeeeeeeeeeeeeeeeeeeeeeeeeeeeeeeeeeeee",
  "classification": "public",
  "redaction": "none",
  "recordedAt": "2026-08-07T00:03:00Z"
}
